店號,店名,地址
111153,大埕,台南市七股區大珵里272號1樓
111360,感恩,台南市永康區烏竹里自強路825-1號
111809,榮譽,台南市東區榮譽街86號86-1號1樓
111821,新國,台南市新營區大宏里民治東路1號1樓2樓
112075,財神,台南市東區中華東路二段171-177號
112422,晶圓,台南市善化區南科北路1-1號(P3廠)
112525,新北中,台南市佳里區延平路195號
112673,港達,台南市安定區港口里245-10號1樓
113126,山上,台南市山上區南洲337-3號
113193,崇祐,台南市東區崇成里崇明路561號1樓
113517,東美,台南市東山區中興路1號
113931,新北,台南市新營區民治路228號1樓
114222,南都,台南市南區金華路一段27號1樓
114532,白河,台南市白河區永安里17鄰國泰路101號
114705,鹽生,台南市鹽水區南門路1號
116011,海寮,台南市安定區海寮里海寮街8號
116181,灣中,台南市永康區大灣路62號
116620,歡雅,台南市鹽水區歡雅里26號
116734,鄭子寮,台南市北區成德里38鄰北成路442號
116826,太子宮,台南市新營區太北里太子宮142-34號
117173,嘉科大,台南市仁德區保安里二仁路一段60號
117520,東都,台南市北區成功路140號
117807,新森榮,台南市中西區成功路451號453號
118338,豐生,台南市歸仁區看東里中山路一段305號
118660,東城,台南市東區中華東路二段293號
119696,湖華,台南市中西區西湖街3號
120087,新麻豆,台南市麻豆區榖興里11鄰中山路11號
120386,東森,台南市北區林森路三段76號78號
120397,佳龍,台南市佳里區建南里勝利路216號1樓
120777,台首大,台南市麻豆區南勢里168號1樓
121035,安北,台南市安南區安中路一段546號552號
121172,新工,台南市柳營區東昇里中山西路一段2號1樓
121688,西勢,台南市永康區西勢里富強路一段304號
121769,永一,台南市永康區正強街221號1樓
122131,佳文,台南市佳里區佳西路215號1樓
122500,昜昇,台南市安平區安北路12-1號1樓
122588,新蓮鄉,台南市白河區永安里大德街150號1樓
123019,慶平,台南市安平區慶平路235號1樓
123112,北育,台南市北區成德里北安路一段189號
123156,水仙宮,台南市中西區水仙里民權路三段87號1樓
124676,崇原,台南市東山區東原里24鄰前大埔191號1樓
126993,善安,台南市安定區蘇林里7號
127022,天公,台南市中西區忠義路二段109號
127158,松美,台南市善化區小新里成功路2-2號
129213,南醫,台南市中西區民族路二段76號之13
130110,林鳳營,台南市六甲區中社里林鳳營111-8號1樓
130280,和善,台南市中西區藥王里民族路三段6鄰277號1樓
130626,社頂,台南市新市區大社里大社710號1樓
130671,鈺勝,台南市北區小東路307巷75號77號1樓
130970,裕文,台南市東區裕學路1號
130992,知母義,台南市新化區知義里知母義15號之20一樓
131113,東橋,台南市永康區東橋一路28號
131146,東山站,台南市東山區科里里枋子林74-6號
131423,土定富,台南市南區田寮里大成路二段86號88號
131630,永科,台南市永康區新樹里3鄰中山北路634巷7號
132149,新興,台南市南區光明里新興路6鄰529號531號1樓
132253,樂豐,台南市南區新都路460號
132390,新家專,台南市永康區鹽行里中正路12鄰545號1樓
132482,七甲,台南市六甲區六甲里中正路321之1號
132596,將軍,台南市將軍區長榮里長榮29之2號
132644,群創C,台南市善化區南科八路12號B1
132688,奇美實,台南市仁德區三甲里59-1號
132862,菁寮,台南市後壁區墨林里346號
132910,成醫,台南市北區小東路35號(成大醫院門診一樓)
133016,新P5,台南市善化區南科九路17號(P5P6廠O棟)
136015,正新,台南市永康區甲頂里大武街33號
136325,新南科,台南市新市區南科三路17號1樓(台南科學工業區)
136598,南門城,台南市中西區南門路229號1樓
136978,善文,台南市善化區中山路518號
137063,新新善,台南市新市區復興路59號61號63號一樓
137122,育德,台南市北區民德路87號
137742,安南,台南市安南區安和路四段520號
137801,南德,台南市南區中華南路二段101之1號
138022,南科大,台南市永康區中正路529號
138066,文五,台南市安平區國平里文平路217號
138251,淵中,台南市安南區安中路三段435號437號
138262,善成,台南市善化區中正路386號
138387,華園,台南市北區北門里公園南路71號
138675,後營,台南市西港區營西里1號
139117,永強,台南市永康區埔園里中正路102號
139265,西門,台南市北區西門路四段132號
139335,大五,台南市中西區法華里大同路一段218號220號
140357,砲校,台南市永康區中山南路566號之1
140519,安平,台南市安平區安平路99號
141039,新醫,台南市新營區民權里民權路96號96-1號1樓
141578,高大,台南市新市區銘傳街87號89號1樓
141800,大忠,台南市南區大忠里中華南路一段178號
141914,蔦松,台南市永康區中正北路431號433號
142308,康永,台南市永康區永康里永平街120號
142537,新圓,台南市新營區忠政里中正路2鄰121號
143079,瀚宇,台南市新市區南科二路35號1樓
143231,新樹人,台南市善化區光文里中山路143-2號
143312,永龍,台南市永康區埔園里中山路398號
143389,期建,台南市安平區文平里建平路277號
143840,大潭,台南市歸仁區大潭里長榮路一段320巷11號
143851,子龍,台南市佳里區子龍里1鄰子良廟3-1號
143862,南龍,台南市佳里區建南里安南路22鄰256號
143873,龍成,台南市北區成功路2號
143884,臻鈺,台南市永康區勝利里18鄰勝學路226號
144131,五王,台南市永康區中華二路146號1樓
144197,安興,台南市永康區北灣里20鄰北興路51號
144979,東澓,台南市東區富農街一段167號1樓
144980,自由,台南市東區和平里自由路二段37號
146252,南瀛,台南市永康區鹽行里中正路299號
146953,新海佃,台南市安南區海佃路一段239號一樓
147266,清美,台南市新化區協興里中山路624號
148410,新永健,台南市中西區健康路一段346號
148487,新東灣,台南市永康區民族路186號188號1樓
149044,華東,台南市永康區中華路472號
149147,遠專,台南市新市區永就里中華路53巷9號
149273,大府,台南市中西區府前路二段115號1樓2樓
149550,永華東,台南市安平區永華路二段210號
150848,鹽金,台南市鹽水區義稠里8鄰義稠110之19號
150882,全興,台南市南區新樂路72號
150985,茄拔,台南市善化區嘉北里13鄰352號
151243,安傑,台南市安南區頂安里北安路二段480號1樓
151357,德航,台南市仁德區大同路三段202號
151494,臻品,台南市永康區三合里中山東路117號119號1樓
151597,長益,台南市仁德區土庫里太子路233號
151977,大營,台南市新市區大營里136-1號
153744,學甲,台南市學甲區仁得里華宗路321號
153755,P7廠,台南市善化區南關里三抱竹路1號
153777,永玉,台南市永康區龍潭里永明街175號
153803,省新,台南市新市區永就里9鄰中山路180號1樓
153814,德緯,台南市北區成德里育德二路20鄰308號
153825,環安,台南市安南區長和路二段12巷272號
153939,宜翔,台南市柳營區中埕里中山西路二段10鄰61號
153940,邦品廠,台南市善化區環西路二段3號
153973,修齊,台南市北區成功路54號
154998,白金,台南市永康區復國一路357號
155119,大通,台南市歸仁區和平北街32號
155164,復康,台南市永康區二王里忠孝路429巷15弄6號
155234,總頭寮,台南市安南區長溪路二段416號
158820,西濱,台南市南區中華南路二段317號319號
159133,晶越,台南市中西區西門路一段658號B2
160052,加吉吉,台南市安南區新順里培安路155號
160351,康平,台南市安平區健康三街81號
161789,嘉凱,台南市仁德區保安里保安路一段56巷55號
162014,新康華,台南市永康區大橋二街38號
163785,和緯,台南市北區成功里和緯路二段252號
163969,郡王,台南市中西區府前路一段144號
164489,學成,台南市學甲區慈生里中正路296號
164700,信雄,台南市永康區南台街1號
164766,忠勇,台南市永康區成功里小東路4鄰637號1樓
164951,力大,台南市東區生產路299號
165079,西港,台南市西港區西港里中山路366-1號
165127,怡平,台南市安平區文平路462號1樓
165138,新東,台南市東區林森路二段84號
165149,小北,台南市北區西門路四段455號
165253,歸仁,台南市歸仁區中山路二段60號
165264,東龍,台南市東區東門路一段362號
165471,立登,台南市歸仁區民生北路106號
165677,赤崁,台南市中西區民族路二段331號
165699,仙草埔,台南市白河區仙草里仙草6之30號
166061,裕豐,台南市東區東門路二段291號
166407,時尚,台南市永康區鹽洲里仁愛街19號21號1樓
166544,富裕,台南市東區後甲里裕農路657號1樓
166957,南台,台南市永康區南台街1號1樓
166979,素心,台南市仁德區中山路258號260號
167019,新六廠,台南市善化區南科北路1號1樓
167020,P1廠,台南市善化區南科北路1之1號1樓
167134,綜合,台南市中西區水仙里民生路二段26號28號1樓
167215,南茂,台南市新市區南科七路5號2樓
167525,聯電,台南市新市區南科三路57號
167569,九份子,台南市安南區國安里九份子大道6號1樓
167798,趣淘,台南市楠西區密枝里密枝102之5號1樓
167802,新天地,台南市柳營區太康里22鄰201-10號
167835,興灣,台南市永康區南灣里大灣東路63號1樓
167891,康西,台南市永康區永大路二段440號
167916,伍鈺,台南市永康區永華路406號408號
167983,安期,台南市安平區慶平路60號62號
169875,好巧,台南市永康區安康里中華西街152號
170185,文南,台南市南區健康路二段270號
171177,建華,台南市南區文華里中華西路一段438號
171214,大灣,台南市永康區大灣路951號
171708,明珠,台南市中西區公正里民族路二段53號
173564,府醫,台南市中西區赤崁里中山路125號
173690,聯晶,台南市新市區豐華里南科二路18號7樓
173885,帝標,台南市東區龍山街109號111號
174110,文賢,台南市北區文賢路1116號
174567,安學,台南市安南區南興里12鄰公學路五段685號一樓
174693,東發,台南市東區中華東路三段379號
175009,佳成,台南市佳里區興化里佳里興492-50號
177371,丹比,台南市北區六甲里西門路四段332號
179573,代天府,台南市北門區鯤江里976號
179768,大瑩,台南市仁德區二行里中正西路347號1樓
179805,康橋,台南市永康區中山南路12-5號
179931,群創B,台南市善化區南關里南科八路12號B1樓
179986,安同,台南市安南區同安路235號
180425,南應大,台南市永康區鹽行里中正七街27.29號1、2樓
180458,海裕,台南市北區雙安里海安路三段219巷5號1樓
180621,仁發,台南市永康區東橋里東橋六街61號
180757,文成,台南市北區文元里文成路775號
180872,成大,台南市北區勝利路138號B1樓
181277,三舍,台南市新市區三舍里三舍55號
181495,康健,台南市北區北門路三段49號
181532,真新,台南市麻豆區油車里油車24之1號
181598,東楨,台南市白河區永安里新興路507號一樓
182362,永成,台南市南區佛壇里明興路1322號1樓
182502,新安發,台南市安定區安加里安定407號
182546,辰佳,台南市永康區永大路二段11號
183181,南化,台南市南化區南化里128號1樓
183516,真潭,台南市歸仁區大潭里中正南路三段22號
183734,立青,台南市歸仁區南保里民權南路一段108號1樓
183778,佳立,台南市佳里區佳東路361號
183907,席悅,台南市東區東光里東興路41號1樓
184036,善良,台南市善化區中正路385號1樓
184438,威保,台南市關廟區南雄路一段851號1樓
184634,嘉藥,台南市仁德區保安里二仁路一段60號1樓
184667,北安,台南市北區公園路599-11號
185305,大欣,台南市北區和緯路五段76號
186216,永勝,台南市永康區六合里中華二路320號1樓
186858,新奇美,台南市永康區甲頂路18.20號一樓
187068,常興,台南市仁德區中正路三段701號
187208,鹽水,台南市鹽水區中正路35號
187219,鳳凰,台南市安南區北安路二段122號
187231,仁興,台南市歸仁區南保里大德路307號
187242,善和,台南市善化區坐駕里大成路319號
187253,郡豐,台南市安平區郡平路307號
187736,仁義,台南市仁德區中正路二段1052號
188061,群創三,台南市新市區環西路二段2號1樓(群創三廠)
188072,群創五,台南市新市區環西路二段2號1樓(群創五廠)
188164,安昌,台南市安南區塭南里安昌街101號
188474,富里,台南市安南區安富里府安路五段154號155號156號
188496,新黎明,台南市麻豆區興國路40-10號
188773,鼎富,台南市關廟區南花里中正路881號
188810,建平,台南市安平區建平七街689號
188887,荷韻,台南市白河區河東里9鄰冀萁湖122-35號
188898,加賀,台南市歸仁區大廟里大廟一街1號
188980,鼎利,台南市關廟區南雄路二段210號
188991,鼎亨,台南市東區德東街101號
189019,永福,台南市中西區永福路二段65號1樓
190260,南站,台南市仁德區中洲里中洲1-15號1樓
190813,小東,台南市東區小東路256號
192783,唯勝,台南市中西區民權路三段150號一樓
192819,和慶,台南市安南區安中路一段701巷33.35號
192978,長安營,台南市仁德區保仁路195號(營區內)
193199,喬興,台南市西港區慶安里新興街8-77.8-78號
193568,北園,"台南市北區北園街6號之6,"
193616,F18,台南市安定區北園二路8號1樓
193867,陽光城,台南市善化區蓮潭里9鄰陽光大道198號1樓
194088,衛國,台南市東區林森路二段192巷24弄5號.7號
194103,橋鈺,台南市永康區東橋七路369號1樓
194321,安醫,台南市安南區州南里12鄰長和路二段66號B1
194343,裕孝,台南市東區裕農路888號1樓
194608,華立,台南市仁德區仁義里中清路208號
194929,金昇,台南市南區金華路二段341號
194963,成商,台南市東區大學里勝利路118號1、2樓
194996,台江,台南市安南區安中路二段140號1樓
195014,上鈺,台南市南區大成路一段128號1、2樓
195243,聖安,台南市安南區安中路六段850號1樓
195298,天期,台南市安平區國平路198號1樓
196176,三麗,台南市新化區協興里正新路305號1樓
197146,明和,台南市南區中華西路一段89號
197294,北站,台南市仁德區中洲里中洲1-16號1樓
197618,華康,台南市永康區中華路8-7號1樓
197928,鎮山,台南市中西區西湖里湖美街10號
198552,台南蔡,台南市永康區中正南路628號
198600,崇學,台南市東區崇善路168號
198747,福耀,台南市東區崇明路377號377-1號
198769,夢公園,台南市學甲區中山路187號1樓
198770,新新樓,台南市東區東門里前鋒路16號1樓
198921,鼎鑫,台南市關廟區中山路二段27號1樓
199027,新市,台南市新市區華興街48號1樓
199050,長和,台南市安南區長和一街39號
199119,工館,台南市永康區崑大路195號
199131,東和,台南市東區東安路291號293號1樓
199348,安東,台南市安南區安和路一段308號1樓
199511,崑教,台南市永康區崑大路195號
199522,高梓,台南市仁德區後璧里中正路二段387號
199533,府城,台南市安平區永華路二段532號
199577,安運,台南市安平區平安里華平路742號1樓
199658,金都,台南市南區金華路一段235號1樓
200284,鑫歐洲,台南市永康區埔園街339號
200402,欣大林,台南市南區大同路二段136巷3號1樓
200826,新大港,台南市北區大和里大港街140號1樓2樓
206905,飛鳥,台南市善化區文光里建國路386號1樓
780827,和順,台南市安南區安和路五段166號
791241,佳里,台南市佳里區光復路197號197-1號
822169,公園,台南市北區公園路1072-1號2號3號
822790,崇明,台南市東區林森路一段184號
833055,長寧,台南市東區長榮路三段12號
842060,武聖,台南市中西區武聖路47號49號
845597,安中,台南市安南區安中路一段711號
846659,仁德,台南市仁德區中山路501號
851064,伍誼,台南市歸仁區復興路162之1號
854557,一心,台南市東區中華東路一段24號
855055,公平,台南市北區公園路694號
860448,森田,台南市東區東門里東門路一段199號
860459,柳營,台南市柳營區士林里柳營路二段1號3號
860688,立人,台南市北區和順里西門路三段81號
861544,嘉南,台南市仁德區二行里二仁路一段151號
863252,六甲,台南市六甲區六甲里22鄰中正路552號
864668,夏林,台南市南區夏林路134-1號134-2號
865535,北門,台南市東區北門路一段310號
865797,大恩,台南市南區大同路二段692號694號
870272,新銀,台南市新營區中山路140號
871596,玉山,台南市永康區永明街97號
871714,隆田,台南市官田區隆田里14鄰文化街130號
871747,聖賢,台南市北區大豐里文賢路315號
872360,玉井,台南市玉井區中正路54號
873363,港龍,台南市安定區港南里163號
874399,大橋,台南市永康區大橋里中華路747號
874757,市醫,台南市東區崇德路685號687號
880143,麻佳,台南市麻豆區苓子林17-13號
880165,那菝,台南市新化區那菝林241號
880419,古都,台南市東區仁和路133號
880811,騰揮,台南市歸仁區中正南路一段110號
881308,超順,台南市學甲區中正路143號
882552,慶安,台南市西港區慶安里新興街25-2號
883256,總安,台南市安南區安和路四段9號
883898,本原,台南市安南區海佃路四段2號
885115,新進,台南市新營區中正路33之14號15號
885997,千福,台南市中西區大涼里中華西路二段36號
886325,友愛,台南市中西區友愛街197之199號
886668,崇道,台南市東區崇善路571號
890324,文炳,台南市永康區南台街1號
891213,德南,台南市仁德區中正路二段224號
892179,鈺華,台南市永康區崑南里37鄰大仁街220號
893482,國銨,台南市安南區國安街111號113號
893792,永復,台南市永康區復華里復華一街2號
894407,立興,台南市南區灣裡路265號
895673,億載,台南市東區大同路二段95-3號
895721,尚頂,台南市永康區中正南路314號
895857,開山,台南市中西區開山路245號
896333,頂美,台南市中西區西和路1號3號
901466,喜樹,台南市南區喜東里10鄰明興路732號
902159,詠文,台南市永康區網寮里6鄰永二街202號
902779,八甲,台南市歸仁區八甲里中正北路一段194號
903152,後壁,台南市後壁區後壁里後壁71號
903392,永正,台南市永康區永康里中山南路537號
903439,七股,台南市七股區七股里14鄰154-1號
905136,體育,台南市中西區健康路166號
905343,精工,台南市永康區中正北路735號
905963,保正,台南市仁德區中正路一段529號
906726,公道,台南市南區夏林路1-16號
909529,城中,台南市安南區安中路六段599號601號
910323,好萊富,台南市新營區南紙里太子路191號
910334,清新,台南市新化區武安里中正路321號
910976,庭園,台南市永康區埔園里龍國街77號
911256,祥安,台南市安南區大安街60號
912097,安富,台南市安南區安富街343號
912400,本安,台南市安南區淵東里安中路三段360號1樓
915203,長榮,台南市東區長榮路三段139號
916516,東敬,台南市東區莊敬路90號
921518,逢安,台南市安南區海西里海中街73號
921655,南鯤鯓,台南市北門區鯤江里841-1號
922670,詠信,台南市永康區復華七街68號
922821,永大春,台南市永康區中山北路431號
923547,南藝,台南市官田區大崎里66號
923868,安新,台南市安南區長溪路三段399號1樓
928829,埔園,台南市永康區中山路90號
930796,同發,台南市安平區安北路170-3號1樓
931272,六發,台南市歸仁區六甲里中正南路一段1020號
931386,鹽行,台南市永康區鹽洲里鹽洲二街83號
931478,麻新,台南市麻豆區中正路289號
931489,蓮營,台南市後壁區福安里200號
931537,星辰,台南市新化區全興里竹子腳177-2號
931559,德發,台南市仁德區中正路三段42號
931836,上營,台南市下營區中營里1286號
932574,東勝,台南市東山區東山里235號
932714,安佃,台南市安南區海佃路四段548號
932884,興農,台南市善化區興農路4號
934732,國平,台南市安平區平通里國平路381號
935735,豐盛,台南市北區勝利路192號194號
935779,致聖,台南市東區北門路二段12號
936484,武德,台南市中西區青年路134號
940254,怡安,台南市安南區安和路二段27號之2
940999,林頂,台南市仁德區中山路155號
941062,東江,台南市永康區尚頂里23鄰南台街43號1樓
941419,新憲,台南市新營區埤寮里中正路530號
941693,新東育,台南市東區大學路西段53號1樓2樓
941936,高長,台南市新市區新和里仁愛街171號
942548,中洲,台南市仁德區中洲里中洲276-16號276-17號
942607,烏山頭,台南市官田區湖山里98-4號98-5號
942652,六分寮,台南市善化區田寮里六分寮74-1號74-2號
943002,科工,台南市安南區鹽田里鹽田路2號
943208,仁灣,台南市永康區大仁街11巷1號
943666,正旺,台南市南區明興路917號
943714,道成,台南市北區北門路二段500號
943884,保東,台南市關廟區關新路二段7號
944278,康榮,台南市北區實踐里北門路三段2號
944555,鈺善,台南市白河區昇安里1鄰三間厝2-56號
944577,本興,台南市安南區公學路四段180號
944658,奇勝,台南市仁德區新田里勝利路139號
946012,永新,台南市永康區中正北路122號
946193,慶東,台南市東區青年路416號
946643,國宅,台南市南區新興路441號
947912,祥發,台南市東區裕豐街187號1樓
950273,好富,台南市東區富強里裕農路320號
950538,文安,台南市仁德區文賢路一段576號
950620,永嘉,台南市永康區二王路139號
950974,立東,台南市東區東門路三段220號
951379,裕興,台南市東區復興里裕文路76號1樓
951483,雋鈺,台南市永康區西灣里永華路157號
951760,將富,台南市將軍區將富里49之八號
951830,華醫,台南市仁德區民安路一段115號
951874,牛墟,台南市善化區什乃里什乃190號
951966,仁伯,台南市仁德區後壁里德安路188號
952280,創意,台南市永康區鹽行里中正二街268號
952291,裕信,台南市東區裕信路352號
953191,常勝,台南市北區長榮里長勝路1號
954080,奇蹟,台南市永康區永大路三段299號
954183,麻善,台南市麻豆區晉江里民權路10-1號
954312,新墘,台南市新市區港墘里民族路118號
954448,新新復,台南市新營區新進路二段466號
954529,長榮大,台南市歸仁區大潭里長榮路一段396號(長榮大學內第4宿舍B1)
958602,德光,台南市東區崇德路269號
958967,新化,台南市新化區中正路557號
962771,吉吉好,台南市東區崇德路670號
962863,湖美,台南市北區大豐里27鄰中華北路一段143號
965057,長溪,台南市安南區安慶里長溪路一段307號
965105,淵安,台南市安南區海佃路三段163號
965264,裕平,台南市東區關聖里裕信路177號1樓
965345,小腳腿,台南市柳營區重溪里義士路一段938號
965600,麻中,台南市麻豆區南勢里南勢36-205號
965611,遠德,台南市新化區北勢里中正路1211號
965633,安高,台南市安定區港尾里港子尾37-28號
966061,車讚,台南市關廟區北花里中正路517號
966212,鹽新,台南市鹽水區橋南里忠孝路93號
966290,安安,台南市安南區安明路四段260-70號
966957,仁大,台南市仁德區太子里太子路120號122號
966991,鹽信,台南市永康區正南一街148號
967086,二鎮,台南市官田區二區里工社西街25巷81號
967570,永愛,台南市永康區北灣里文賢街80-1號
967581,保華,台南市仁德區成功里崇德路88號
967639,仁文,台南市東區仁和路57-7號59號1樓
967673,桂田,台南市永康區鹽行里新行街251號一樓
967891,虎尾寮,台南市仁德區仁德里文德路157號
967938,新正賢,台南市仁德區保安里中正路一段209號
968104,華平,台南市安平區健康路三段242號
968263,新曾文,台南市麻豆區東角里興中路177號179號
968780,鯤鯓,台南市南區南都里鯤鯓路20號
968805,新永華,台南市中西區永華路248號
969015,新同安,台南市安南區理想里海佃路二段432號
970174,鈺廣,台南市永康區大灣里民族路409號一樓
970255,欣奇,台南市新營區新東里東興路236號
970266,新凱,台南市新市區社內里12之5號
970277,新大內,台南市大內區石城里石子瀨122之153號
970358,麻學,台南市麻豆區大山里8鄰大山腳1之80號
970819,安立,台南市安南區安中路四段150號
971018,關聖,台南市關廟區南雄路一段471號
971465,善營,台南市善化區小新里成功路173之1號
971487,新吉,台南市安定區新吉里新吉126之12_126之13號
971498,少觀,台南市南區大林路113號
971878,楠西,台南市楠西區鹿田里11鄰油車61號之10
973014,新運河,台南市中西區府前路二段239號1樓
978558,慶國,台南市安平區慶平路531號
980126,新安順,台南市安南區安和路三段55-1號57號1樓
980296,大目降,台南市新化區正新路233號
980838,新雙新,台南市新市區永就里中山路227號1樓
981059,新佳興,台南市佳里區東寧里文化路196號1樓
981602,豐平,台南市安平區平豐路430號1樓
