店號,店名,地址
977485,心心,新北市板橋區實踐路105號107號
977636,新圓山,新北市五股區成泰路一段191號
977913,濬家,新北市土城區廣明街2號
977935,汐止站,新北市汐止區信義路1號
978606,昇庚,新北市永和區永貞路182號184號
978640,泰股,新北市五股區成泰路三段577巷24號
978662,遠揚,新北市板橋區南雅南路二段124號
978802,安福,新北市永和區福和路213號
979241,日勝,新北市泰山區山腳里泰林路二段515號517號
979263,華翠,新北市板橋區莒光路63號
980090,新燕,新北市新店區新烏路二段382號384號1樓
980805,新展盛,新北市新莊區西盛街325號327號1樓
980942,府運,新北市板橋區重慶路18號20號1樓
981347,巧立,新北市淡水區北新路184巷57號59號1樓
981794,嶄新,新北市新店區中正路57-2號1樓
981990,全茂,新北市中和區連城路469巷9號11號
982007,學勤,新北市三峽區學勤路105號及大德路211號1樓
982328,長虹,新北市鶯歌區鶯桃路432號1樓
982579,新觀和,新北市板橋區大觀路二段55號57號1樓
982627,新福圓,新北市新莊區五工三路93號1樓
985349,鎮鑫,新北市新店區中興路一段289號
985534,正隆,新北市板橋區民生路一段53號
985545,鑫強,新北市三重區自強路三段30號32號
985604,淡江,新北市淡水區學府路207號
985615,竹林,新北市永和區竹林路211號
985671,利客來,新北市五股區成泰路三段419號
985682,泰隆,新北市中和區立德街102號
985785,珈英,新北市蘆洲區復興路92號
987769,工林,新北市林口區工六路76號
987909,來鑫,新北市烏來區忠治里堰堤9號11號
989411,三重,新北市三重區重新路三段18號
990204,聯合報,新北市汐止區大同路一段369號1樓
990260,涵碧,新北市新店區碧潭路37號
990639,新吉麗,新北市蘆洲區中山一路204號1樓
990640,新保捷,新北市永和區保生路22巷2號1樓
991137,武強,新北市淡水區自強路375號1樓
991333,新明,新北市新店區光明街140號
991458,八里,新北市八里區中山路二段343號1樓
991654,仁仁,新北市三重區仁愛街50號
992037,中一,新北市板橋區中正路332之5號1樓
992495,江菱,新北市新店區民權路93號1樓
992576,樹安,新北市樹林區大安路530號1樓
992598,麗金,新北市永和區成功路一段83號85號1樓
992624,北福,新北市永和區福和路121號1樓
992897,忠承,新北市土城區忠承路103號1樓
992923,皇翔,新北市土城區中央路一段88號1樓、裕民路10-1號.10號.8-1號.8號
993144,奕真,新北市泰山區明志路二段185號1樓(部份)
993650,壽德,新北市中和區壽德街11號1樓
993867,鶯育,新北市鶯歌區南雅路34號36號1樓
996121,連豐,新北市新店區大豐路12號
996132,五華,新北市三重區五華街148號
996202,聖運,新北市土城區柑林里明德路二段159號
996235,新樟樹,新北市汐止區樟樹二路255號
996279,懷民,新北市板橋區民治街111號
996338,正大,新北市三重區中正北路235號
996903,百和,新北市新店區中正路306號308號
996969,天勝,新北市三重區仁愛街687號
997962,橫溪,新北市三峽區溪北街109號
998105,國瑞,新北市新莊區新樹路300號之5
999359,復美,新北市永和區秀朗路一段146號
999854,金全,新北市金山區清水路52號
999898,康湖,新北市汐止區康寧街490號
